{
  "schema_version": "1.0",
  "spec_version": "1.0.0",
  "operation_id": "workflow-01",
  "observed_at": "2026-10-03T00:00:10Z",
  "kind": "dependent_workflow",
  "failure_policy": "stop",
  "steps": [
    {
      "id": "inspect",
      "depends_on": [],
      "operation_id": null,
      "status": "completed",
      "receipt": null,
      "output_refs": [
        "evidence://synthetic/read-snapshot-01"
      ],
      "skip_reason": null,
      "error": null,
      "phase": "observe",
      "effects": [
        "observe"
      ]
    },
    {
      "id": "plan",
      "depends_on": [
        "inspect"
      ],
      "operation_id": null,
      "status": "completed",
      "receipt": null,
      "output_refs": [
        "plan://synthetic/plan-01"
      ],
      "skip_reason": null,
      "error": null,
      "phase": "plan",
      "effects": [
        "observe"
      ]
    }
  ],
  "summary": {
    "total": 2,
    "not_started": 0,
    "running": 0,
    "completed": 2,
    "failed": 0,
    "skipped": 0,
    "cancelled": 0,
    "unknown": 0
  }
}
