{
  "schema_version": "1.0",
  "spec_version": "1.0.0",
  "operation_id": "workflow-01",
  "observed_at": "2026-10-03T00:00:10Z",
  "kind": "independent_batch",
  "failure_policy": "continue_independent",
  "steps": [
    {
      "id": "create",
      "depends_on": [],
      "operation_id": "operation-create",
      "status": "completed",
      "receipt": {
        "operation_id": "operation-create",
        "target": {
          "mode": "session",
          "engine_id": "editor-engine",
          "instance_id": "instance-01",
          "object_id": "document-01",
          "locator": "session://instance-01/document-01"
        },
        "authorization_scope_id": "scope-isolated-01",
        "effects": [
          "change"
        ],
        "snapshot_before": {
          "id": "snapshot-01",
          "source": "live",
          "revision": "memory-01",
          "observed_at": "2026-10-02T00:00:00Z",
          "dependencies": [
            {
              "identity": "template-01",
              "revision": "sha256:aaaaaaaaaaaaaaaaaaaaaaaaaaaaaaaaaaaaaaaaaaaaaaaaaaaaaaaaaaaaaaaa"
            }
          ]
        },
        "snapshot_after": {
          "id": "snapshot-02",
          "source": "live",
          "revision": "memory-02",
          "observed_at": "2026-10-02T00:00:01Z",
          "dependencies": [
            {
              "identity": "template-01",
              "revision": "sha256:aaaaaaaaaaaaaaaaaaaaaaaaaaaaaaaaaaaaaaaaaaaaaaaaaaaaaaaaaaaaaaaa"
            }
          ]
        },
        "outcome": {
          "execution": "completed",
          "change": "applied",
          "persistence": "unsaved",
          "verification": {
            "status": "passed",
            "scope": "declared_operation_postconditions",
            "snapshot_id": "snapshot-02",
            "coverage": "complete",
            "checks": [
              {
                "id": "check-object-readback",
                "status": "passed",
                "required": true,
                "evidence_ref": "evidence://synthetic/readback-01"
              }
            ],
            "not_checked": [
              {
                "id": "domain-suitability",
                "required": false,
                "reason": "Outside the declared operation scope."
              }
            ],
            "evidence_refs": [
              "evidence://synthetic/readback-01"
            ]
          }
        },
        "changed_items": [
          {
            "id": "object-02",
            "change": "created",
            "evidence_ref": "evidence://synthetic/readback-01"
          }
        ],
        "artifacts": [],
        "recovery": {
          "action": "none",
          "reason": "Declared in-memory operation verified; save was not requested.",
          "supported": true
        }
      },
      "output_refs": [],
      "skip_reason": null,
      "error": null,
      "phase": "apply",
      "effects": [
        "change"
      ]
    },
    {
      "id": "build",
      "depends_on": [],
      "operation_id": "operation-build",
      "status": "failed",
      "receipt": {
        "operation_id": "operation-build",
        "target": {
          "mode": "session",
          "engine_id": "editor-engine",
          "instance_id": "instance-01",
          "object_id": "document-01",
          "locator": "session://instance-01/document-01"
        },
        "authorization_scope_id": "scope-isolated-01",
        "effects": [
          "change"
        ],
        "snapshot_before": {
          "id": "snapshot-01",
          "source": "live",
          "revision": "memory-01",
          "observed_at": "2026-10-02T00:00:00Z",
          "dependencies": [
            {
              "identity": "template-01",
              "revision": "sha256:aaaaaaaaaaaaaaaaaaaaaaaaaaaaaaaaaaaaaaaaaaaaaaaaaaaaaaaaaaaaaaaa"
            }
          ]
        },
        "snapshot_after": {
          "id": "snapshot-02",
          "source": "live",
          "revision": "memory-02",
          "observed_at": "2026-10-02T00:00:01Z",
          "dependencies": [
            {
              "identity": "template-01",
              "revision": "sha256:aaaaaaaaaaaaaaaaaaaaaaaaaaaaaaaaaaaaaaaaaaaaaaaaaaaaaaaaaaaaaaaa"
            }
          ]
        },
        "outcome": {
          "execution": "failed",
          "change": "partial",
          "persistence": "unsaved",
          "verification": {
            "status": "incomplete",
            "scope": "dependent_workflow",
            "snapshot_id": "snapshot-02",
            "coverage": "partial",
            "checks": [],
            "not_checked": [
              {
                "id": "build-postcondition",
                "required": true,
                "reason": "Native execution failed after partial application."
              }
            ],
            "evidence_refs": []
          }
        },
        "changed_items": [
          {
            "id": "object-02",
            "change": "created",
            "evidence_ref": "evidence://synthetic/readback-01"
          }
        ],
        "artifacts": [],
        "recovery": {
          "action": "inspect",
          "reason": "Inspect the partial build before choosing a recovery action.",
          "supported": true
        }
      },
      "output_refs": [],
      "skip_reason": null,
      "error": {
        "code": "E_NATIVE_FAILURE",
        "message": "Native build failed after partial application.",
        "retryable": false,
        "details": {
          "next_action": "inspect operation-build"
        }
      },
      "phase": "apply",
      "effects": [
        "change"
      ]
    },
    {
      "id": "inspect",
      "depends_on": [],
      "operation_id": null,
      "status": "completed",
      "receipt": null,
      "output_refs": [
        "evidence://synthetic/independent-read-01"
      ],
      "skip_reason": null,
      "error": null,
      "phase": "observe",
      "effects": [
        "observe"
      ]
    }
  ],
  "summary": {
    "total": 3,
    "not_started": 0,
    "running": 0,
    "completed": 2,
    "failed": 1,
    "skipped": 0,
    "cancelled": 0,
    "unknown": 0
  }
}
